Gericht,Aktenzeichen,Datum,Art,Rechtsgrundlage,Text,Schlagwort,Urteil,pagination,pagination-href
Verwaltungsgericht Saarland,3 K 1544/11,24.04.2013,Urteil,Informationsfreiheitsgesetz (Saarland),"Das Gericht verurteilt ein Kreisjugendamt zur Offenlegung von Aktenvorgängen gegenüber den Klägern zu ihrem Pflegekind, soweit sie selbst betreffende Schreiben und Notizen enthalten sind. Die ursprünglich vollumfänglich beantragte Akteneinsicht in beim Kreisjugendamt geführte Akten über das Pflegekind ist nur eingeschränkt zu gewähren, da sie Material enthalten, das einer gesetzlichen Geheimhaltungspflicht unterliegt. Zu den besonderen Amtsgeheimnissen des § 3 Nr. 4 IFG gehört das Sozialgeheimnis. Die in den Akten enthaltenen Sozialdaten sind zumindest teilweise auch personenbezogene Daten i.S.d. § 5 IFG, so dass es zu einer Überschneidung der Anwendungsbereiche beider Vorschriften kommt. Die Kläger haben jedoch ihr Einsichtsbegehren eingeschränkt und einer Schwärzung eventuell schutzbedürftiger Daten zugestimmt. Die Voraussetzungen für eine teilweise Informationsgewährung liegen vor. Das Einverständnis mit der Unkenntlichmachung der Informationen zu Dritten sorgt für eine Verfahrensbeschleunigung, weil das Beteiligungsverfahrem entbehrlich wird. Die Berufung auf einen unverhältnismäßig hohen Arbeitsaufwand dürfte die Informationsgewährung nur dann beschränken, wenn trotz verlängerter Bearbeitungszeiten und zusätzlicher Gebühren die Funktionsfähigkeit der Behörde und die Wahrnehmung der eigentlichen Sachaufgaben dieser blockiert zu werden droht.","(Gesetzliche) Geheimhaltungspflichten, Aussonderungen, Bestimmtheit des Antrags, Drittbetroffenheit, Personenbezogene Daten",http://www.lda.brandenburg.de/media_fast/5955/VG_Saarland_3_K_1544_11.pdf,8,http://www.lda.brandenburg.de/sixcms/detail.php?template=rechtsprechungsdb_erg_d&sort=datum&order=desc&gerichte_title=&title=&sm[title]=tablescan&sm[vt_db]=fulltext_all&datum_von=&datum_bis=&art2_title=&vt_db=&max=&skip=140
Oberverwaltungsgericht Nordrhein-Westfalen,13 B 215/13,24.04.2013,Beschluss,"Lebensmittel-, Bedarfsgegenstände- und Futtermittelgesetzbuch","Die im Lebensmittel- und Futtermittelgesetzbuch vorgesehene Information der Öffentlichkeit über Hygienemängel verletzt die informationelle Selbstbestimmung der betroffenen Lebensmittel- und Futtermittelunternehmer, weil die Dauer der Veröffentlichung gesetzlich nicht befristet wurde. Die Bestimmung einer solchen Dauer darf der Gesetzgeber nicht der Verwaltung (z.B. durch Verwaltungsvorschriften) überlassen.",Veröffentlichung von Informationen,http://www.lda.brandenburg.de/media_fast/5955/OVG_NW_13_B_215_13.pdf,8,http://www.lda.brandenburg.de/sixcms/detail.php?template=rechtsprechungsdb_erg_d&sort=datum&order=desc&gerichte_title=&title=&sm[title]=tablescan&sm[vt_db]=fulltext_all&datum_von=&datum_bis=&art2_title=&vt_db=&max=&skip=140
Oberverwaltungsgericht Nordrhein-Westfalen,13 B 192/13,24.04.2013,Beschluss,"Lebensmittel-, Bedarfsgegenstände- und Futtermittelgesetzbuch","Die im Lebensmittel- und Futtermittelgesetzbuch vorgesehene Information der Öffentlichkeit über Hygienemängel verletzt die informationelle Selbstbestimmung der betroffenen Lebensmittel- und Futtermittelunternehmer, weil die Dauer der Veröffentlichung gesetzlich nicht befristet wurde.  Die Bestimmung einer solchen Dauer darf der Gesetzgeber nicht der Verwaltung (z.B. durch Verwaltungsvorschriften) überlassen. Es fehlt eine gesetzliche Ermächtigungsgrundlage für die Veröffentlichung.",Veröffentlichung von Informationen,http://www.lda.brandenburg.de/media_fast/5955/OVG_NW_13_B_192_13.pdf,8,http://www.lda.brandenburg.de/sixcms/detail.php?template=rechtsprechungsdb_erg_d&sort=datum&order=desc&gerichte_title=&title=&sm[title]=tablescan&sm[vt_db]=fulltext_all&datum_von=&datum_bis=&art2_title=&vt_db=&max=&skip=140
Oberverwaltungsgericht Nordrhein-Westfalen,13 B 238/13,24.04.2013,Beschluss,"Lebensmittel-, Bedarfsgegenstände- und Futtermittelgesetzbuch","Die im Lebensmittel- und Futtermittelgesetzbuch vorgesehene Information der Öffentlichkeit über Überschreitungen von Grenzwerten, Höchstgehalten oder Höchstmengen verletzt die informationelle Selbstbestimmung der betroffenen Lebensmittel- und Futtermittelunternehmer, weil die Dauer der Veröffentlichung gesetzlich nicht befristet wurde. Die Bestimmung einer solchen Dauer darf der Gesetzgeber nicht der Verwaltung (z.B. durch Verwaltungsvorschriften) überlassen.",Veröffentlichung von Informationen,http://www.lda.brandenburg.de/media_fast/5955/OVG_NW_13_B_238_13.pdf,8,http://www.lda.brandenburg.de/sixcms/detail.php?template=rechtsprechungsdb_erg_d&sort=datum&order=desc&gerichte_title=&title=&sm[title]=tablescan&sm[vt_db]=fulltext_all&datum_von=&datum_bis=&art2_title=&vt_db=&max=&skip=140
Bundesverwaltungsgericht,7 B 43.12,27.05.2013,Beschluss,Sonstige,"Das Bundesverwaltungsgericht setzt sich mit der Definition von Archivgut im Sinne des Bundesarchivgesetzes auseinander und bestätigt die Auslegung der Vorinstanzen. Die Gewährung eines Zugangsanspruchs nach dem IFG setzt voraus, dass der Anspruchsverpflichtete selbst tatsächlich Zugriff auf die Informationen hat. Muss sich die informationspflichtige Stelle diesen Zugriff erst verschaffen, bedarf es einer Rechtsgrundlage, um gegenüber Behörden und Privaten, die im Besitz der Informationen sind, ein Herausgabeverlangen durchsetzen zu können. Wie im Archivrecht fehlt diese auch im Informationsfreiheitsgesetz. Die Informationsfreiheit gemäß Art. 5 Abs. 1 Satz 1 Alt. 2 Grundgesetz, die den Zugang zu aus allgemeine zugänglichen Quellen stammenden Informationen schützt, gibt keinen verfassungsunmittelbaren Zugang zu amtlichen Informationen. Die Revision wird nicht zugelassen.","Begriffsbestimmung, Konkurrierende Rechtsvorschriften",http://www.lda.brandenburg.de/media_fast/5955/BVerwG_7_B_43_12.pdf,8,http://www.lda.brandenburg.de/sixcms/detail.php?template=rechtsprechungsdb_erg_d&sort=datum&order=desc&gerichte_title=&title=&sm[title]=tablescan&sm[vt_db]=fulltext_all&datum_von=&datum_bis=&art2_title=&vt_db=&max=&skip=140
Oberverwaltungsgericht Berlin-Brandenburg,12 S 23.13,28.05.2013,Beschluss,Informationsfreiheitsgesetz (Berlin),"Das Oberverwaltungsgericht bestätigt die Auffassung der ersten Instanz, dass die im Wege  einstweiliger Anordnung begehrte Verpflichtung des Antragsgegners zur Gewährung von Informationszugang auf eine endgültige Vorwegnahme der Hauptsache gerichtet und daher abzuweisen ist. Von dem Begriffsmerkmal ""Arbeiten und Beschlüsse"" zur unmittelbaren Vorbereitung einer Entscheidung im Sinne des Informationsfreiheitsgesetz werden alle Aktenteile erfasst die unmittelbar mit dem Entscheidungsprozess zusammenhängen. Umfasst sind auch Vorarbeiten und Ausarbeitungen, aus denen die zu treffende Entscheidung entwickelt werden soll, unabhängig davon, zu welchem Zeitpunkt diese Vorarbeiten entstanden sind. Der Ausschlussgrund knüpft daran an, dass die Vorarbeiten einer konkret bevorstehenden Entscheidung dienen und greift nur ein, soweit und solange durch die vorzeitige Bekanntgabe der Informationen der Erfolg der Entscheidung/Maßnahme vereitelt würde. Im Aktenbestand des Bundesinnenministeriums befindliche Gutachten/Stellungnahmen von Landesinnenministerien sind keine Aufzeichnungen ""Dritter"" im Sinne des Informationsfreiheitsgesetzes.","Begriffsbestimmung, Entwürfe oder Vorarbeiten, Prozessuales",http://www.lda.brandenburg.de/media_fast/5955/OVG_BE_BB_12_S_23_13.pdf,8,http://www.lda.brandenburg.de/sixcms/detail.php?template=rechtsprechungsdb_erg_d&sort=datum&order=desc&gerichte_title=&title=&sm[title]=tablescan&sm[vt_db]=fulltext_all&datum_von=&datum_bis=&art2_title=&vt_db=&max=&skip=140
Verwaltungsgericht Potsdam,9 L 34/13,30.05.2013,Beschluss,Akteneinsichts- und Informationszugangsgesetz (Brandenburg),"Das Verwaltungsgericht lehnt einen Antrag auf einstweilige Anordnung über den Zugang zu Informationen ab, die den Ministerpräsidenten in seiner Funktion als Mitglied des Aufsichtsrats einer Gesellschaft, an der das Land beteiligt ist, vorliegen. Als Mitglied des Aufsichtsrats gehört der Antragsgegner nicht zu den genannten auskunftsverpflichteten Stellen.  Außerdem dürften die dem Ministerpräsidenten in dieser Funktion zugegangenen Unterlagen auch nicht unter den Aktenbegriff des Akteneinsichts- und Informationszugangsgesetzes fallen, der nur Unterlagen umfasst, soweit diese ausschließlich amtlichen oder dienstlichen Zwecken dienen. Die Informationen fallen zudem unter den Schutz unternehmensbezogener Daten, der über den in anderen Informationsfreiheitsgesetzen geregelten Schutz von Betriebs- und Geschäftsgeheimnissen hinausgeht.","(Gesetzliche) Geheimhaltungspflichten, Anwendungsbereich/Zuständigkeit, Begriffsbestimmung, Betriebs- und Geschäftsgeheimnisse, Konkurrierende Rechtsvorschriften",http://www.lda.brandenburg.de/media_fast/5955/VG_Potsdam_9_L_34_13.pdf,7,http://www.lda.brandenburg.de/sixcms/detail.php?template=rechtsprechungsdb_erg_d&sort=datum&order=desc&gerichte_title=&title=&sm[title]=tablescan&sm[vt_db]=fulltext_all&datum_von=&datum_bis=&art2_title=&vt_db=&max=&skip=120
Verwaltungsgericht Berlin,2 K 57.12,30.05.2013,Urteil,Informationsfreiheitsgesetz (Bund),"Das Bundeskanzleramt wird verpflichtet, den Antrag des Klägers auf Zugang zu Informationen über die Rote Armee Fraktion (Bericht des Generalbundesanwalts / Haftbefehl) teilweise neu zu bescheiden. Die Verweigerung des Zugangs zu einem weiteren Teil der Dokumente war hingegen rechtmäßig. Das Bundesarchivgesetz verdrängt das Informationsfreiheitsgesetz nur insoweit, als es die in Archivgut des Bundes überführten Informationen betrifft.  Zwar besteht im Regelfall eine Übereinstimmung zwischen Besitz und Verfügungsberechtigung über eine Information, doch ist vorliegend das vom Anwendungsbereich des Informationsfreiheitsgesetzes ausgenommene Bundesamt für Verfassungsschutz Urheber der in Rede stehenden Unterlagen. Eine Übertragung der Verfügungsberechtigung auf andere Behörden, die auch im Besitz des Dokuments sind und dem Anwendungsbereich unterfallen, würde dem Zweck der Ausnahmebestimmung zuwiderlaufen. Der entsprechende Passus des Informationsfreiheitsgesetzes steht einer stillschweigenden oder gesetzlichen Übertragung der Verfügungsberechtigung entgegen. Auf das formale Kriterium der ""Passivlegitimation"" kommt es hier mithin nicht an.","(Gesetzliche) Geheimhaltungspflichten, Begriffsbestimmung, Interessenabwägung, Konkurrierende Rechtsvorschriften, Kosten, Personenbezogene Daten, Sicherheitsaspekte",http://www.lda.brandenburg.de/media_fast/5955/VG_Berlin_2_K_57_12.pdf,7,http://www.lda.brandenburg.de/sixcms/detail.php?template=rechtsprechungsdb_erg_d&sort=datum&order=desc&gerichte_title=&title=&sm[title]=tablescan&sm[vt_db]=fulltext_all&datum_von=&datum_bis=&art2_title=&vt_db=&max=&skip=120
Verwaltungsgericht Berlin,2 K 286.12,06.06.2013,Urteil,Informationsfreiheitsgesetz (Bund),"Das Bundesministerium des Innern wird verpflichtet, dem Kläger Zugang zu einem bestimmten Tagesordnungspunkt des Protokolls einer Ausländerreferentenbesprechung (Bund-Länder-Treffen) zu gewähren. Das Verwaltungsgericht stellt fest, dass die Verfügungsberechtigung an dem Protokoll nicht bei allen beteiligten Ländern, sondern beim federführenden Bundesministerium, das die Protokolle selbst erstellt, liegt. Der von der Behörde geltend gemachte Schutz der Beratungen von Behörden kommt als Ausschlussgrund nicht zum Tragen, da entweder nicht erkennbar ist, dass die streitbefangenen Tagesordnungspunkte Angaben über den geschützten Beratungsprozess enthalten oder eine mögliche Beeinträchtigung nicht plausibel dargelegt wurde bzw. nicht nachvollziehbar ist, dass eine solche zum Zeitpunkt der Verhandlung noch bestehen soll. Siehe auch Parallelverfahren: VG Berlin, 2 K 176.13 und 2 K 255.12.","Anwendungsbereich/Zuständigkeit, Beratungsgeheimnis (behördlicher Entscheidungsprozess)",http://www.lda.brandenburg.de/media_fast/5955/VG_Berlin_2_K_286_12.pdf,7,http://www.lda.brandenburg.de/sixcms/detail.php?template=rechtsprechungsdb_erg_d&sort=datum&order=desc&gerichte_title=&title=&sm[title]=tablescan&sm[vt_db]=fulltext_all&datum_von=&datum_bis=&art2_title=&vt_db=&max=&skip=120
Verwaltungsgericht Berlin,2 K 255.12,06.06.2013,Urteil,Informationsfreiheitsgesetz (Bund),"Das Bundesministerium des Innern wird verpflichtet, dem Kläger Zugang zu bestimmten Tagesordnungspunkten der Protokolle einer Ausländerreferentenbesprechung (Bund-Länder-Treffen) zu gewähren. Das Verwaltungsgericht stellt fest, dass die Verfügungsberechtigung an dem Protokoll nicht bei allen beteiligten Ländern, sondern beim federführenden Bundesministerium, das die Protokolle selbst erstellt, liegt. Der von der Behörde geltend gemachte Schutz der Beratungen von Behörden kommt als Ausschlussgrund nicht zum Tragen, da die streitbefangenen Tagesordnungspunkte entweder keine Angabe über den geschützten Beratungsprozess, sondern nur über das Ergebnis enthalten oder eine mögliche Beeinträchtigung nicht plausibel dargelegt wurde bzw. nicht nachvollziehbar ist, dass eine solche zum Zeitpunkt der Verhandlung noch bestehen soll. Siehe auch Parallelverfahren: VG Berlin, 2 K 176.13 und 2 K 286.12.","Anwendungsbereich/Zuständigkeit, Beratungsgeheimnis (behördlicher Entscheidungsprozess)",http://www.lda.brandenburg.de/media_fast/5955/VG_Berlin_2_K_255_12.pdf,7,http://www.lda.brandenburg.de/sixcms/detail.php?template=rechtsprechungsdb_erg_d&sort=datum&order=desc&gerichte_title=&title=&sm[title]=tablescan&sm[vt_db]=fulltext_all&datum_von=&datum_bis=&art2_title=&vt_db=&max=&skip=120
Gericht der Europäischen Union,T-93/11,07.06.2013,Urteil,Verordnung (EG) Nr. 1049/2001 (Transparenzverordnung),"Das Gericht weist die Klage einer Nichtregierungsorganisation gegen die Kommission auf Akteneinsicht in Aufzeichnungen über Gespräche, E-Mails und Briefe zwischen der Kommission und Unternehmensverbänden über das Freihandelsabkommen zwischen Indien und der Europäischen Union ab. Eine fehlerhafte Anwendung von Art. 4 Abs. 1 der Verordnung (EG)1049/2001 (Transparenzverordnung) liegt nicht vor. Die Sitzungsprotokolle sind keine allgemein zugänglichen Dokumente im Sinne der Transparenzverordnung; sie richteten sich vielmehr an einen bestimmten im Voraus festgelegten Personenkreis. Die Einstufung eines Dokumentes als sensibel kann allein nicht die Anwendung der Versagungsgründe nach Art. 4 Abs. 1 Transparenzverordnung rechtfertigen. Entsprechend genügt das Fehlen eines Vermerks im Sinne von Art. 9 Abs. 1 Transparenzverordnung nicht, um eine Anwendbarkeit der Ausnahmen des Art. 4 auszuschließen. Bei den Industriezweigen, denen gegenüber die Dokumente offengelegt wurden, und der Klägerin liegen objektiv unterschiedliche Situationen vor, welche die unterschiedliche Behandlung bei der Offenlegung rechtfertigen.","(Gesetzliche) Geheimhaltungspflichten, Allgemein zugängliche Quelle, Beratungsgeheimnis (behördlicher Entscheidungsprozess), Internationale Beziehungen",http://www.lda.brandenburg.de/media_fast/5955/EuG_T_93_11.pdf,7,http://www.lda.brandenburg.de/sixcms/detail.php?template=rechtsprechungsdb_erg_d&sort=datum&order=desc&gerichte_title=&title=&sm[title]=tablescan&sm[vt_db]=fulltext_all&datum_von=&datum_bis=&art2_title=&vt_db=&max=&skip=120
Verwaltungsgericht Koblenz,4 K 191/13,13.06.2013,Urteil,Informationsfreiheitsgesetz (Rheinland-Pfalz),"Ein Rechtsschutzbedürfnis kann dem Kläger - trotz Auslaufen des Pachtvertrags, in den er einsehen möchte - nicht abgesprochen werden, da ein Anspruch nach dem Landesinformationsfreiheitsgesetz kein berechtigtes Interesse voraussetzt. Ein Landpachtvertrag zwischen einer Gemeinde und einer Privatperson ist zwar keine hoheitliche Tätigkeit, zählt aber zur fiskalischen Verwaltung, dient dienstlichen Zwecken und ist (wohl) als amtliche Information einzuordnen. Dem Anspruch auf Informationszugang steht aber jedenfalls entgegen, dass Zugang zu Betriebs- und Geschäftsgeheimnissen nur mit Einwilligung des Betroffenen erteilt werden darf, welche nicht vorliegt. Bei einem Pachtvertrag mit seinen nur den Vertragsparteien bekannten Konditionen (insbesondere Pachtzins und Zahlungsbedingungen) handelt es sich um Betriebs- und Geschäftsgeheimnisse, die Rückschlüsse der Konkurrenz auf die Betriebsführung des Pächters zulassen können. Es ist nicht Sinn des Landesinformationsfreiheitsgesetzes, über den allgemeinen und voraussetzungslosen Informationsanspruch Konkurrenten oder sonstigen Dritten Einblick in betriebliche Interna zu gewähren und diesen damit einen Wettbewerbsvorteil zu verschaffen.","Betriebs- und Geschäftsgeheimnisse, Durchführung des Antragsverfahrens",http://www.lda.brandenburg.de/media_fast/5955/VG_Koblenz_4_K_191_13.pdf,7,http://www.lda.brandenburg.de/sixcms/detail.php?template=rechtsprechungsdb_erg_d&sort=datum&order=desc&gerichte_title=&title=&sm[title]=tablescan&sm[vt_db]=fulltext_all&datum_von=&datum_bis=&art2_title=&vt_db=&max=&skip=120
Europäischer Gerichtshof für Menschenrechte,418135/10,25.06.2013,Urteil,Europäische Menschenrechtskonvention,"In dem Fall ""Youth Initiative for Human Rights gegen Serbien"" ordnet der Europäische Gerichtshof für Menschenrechte an, dass der serbische Staat die in Rede stehenden Informationen des Geheimdienstes zum Einsatz elektronischer Überwachungsmaßnahmen herauszugeben hat. Die Klägerin, eine Nichtregierungsorganisation, beabsichtigte, mit den Informationen zur öffentlichen Diskussion beizutragen. Die trotz gegenteiliger, verbindlicher Entscheidung des nationalen Informationsfreiheitsbeauftragten erfolgte Weigerung des serbischen Geheimdienstes, die Informationen offenzulegen bzw. seine nicht überzeugende Behauptung, darüber nicht zu verfügen, stellen vor diesem Hintergrund eine Verletzung des Rechts der Klägerin auf freie Meinungsäußerung aus Art. 10 Europäische Menschenrechtskonvention dar.","Ablehnungsbegründung, Allgemein zugängliche Quelle, Sicherheitsaspekte",http://www.lda.brandenburg.de/media_fast/5955/EGMR_41835_06.pdf,7,http://www.lda.brandenburg.de/sixcms/detail.php?template=rechtsprechungsdb_erg_d&sort=datum&order=desc&gerichte_title=&title=&sm[title]=tablescan&sm[vt_db]=fulltext_all&datum_von=&datum_bis=&art2_title=&vt_db=&max=&skip=120
Verwaltungsgericht Braunschweig,5 A 33/11,26.06.2013,Urteil,Informationsfreiheitsgesetz (Bund),"Es besteht kein Anspruch auf Zugang zu Messergebnissen, die die beklagte Physikalisch-Technische Bundesanstalt im Rahmen von Testfahrten gewonnen hat. Das Gericht begründet dies mit dem entgegenstehenden Schutz geistigen Eigentums, und zwar insbesondere im Hinblick auf Tätigkeiten aus dem Bereich der Wissenschaft und Forschung. Die Testergebnisse fallen unter den Schutz der Wissenschaftsfreiheit. Dies gilt auch dann, wenn die Anstalt mit den Testreihen nicht ausschließlich einen wissenschaftlichen Ansatz verfolgt hat, sondern auch die Zulassung eines Messgeräts geprüft hat.",Urheberrecht,http://www.lda.brandenburg.de/media_fast/5955/VG_Braunschweig_5_A_33_11.pdf,7,http://www.lda.brandenburg.de/sixcms/detail.php?template=rechtsprechungsdb_erg_d&sort=datum&order=desc&gerichte_title=&title=&sm[title]=tablescan&sm[vt_db]=fulltext_all&datum_von=&datum_bis=&art2_title=&vt_db=&max=&skip=120
Bundesverwaltungsgericht,7 A 15.10,27.06.2013,Urteil,Informationsfreiheitsgesetz (Bund),"Der Kläger hat keinen Anspruch darauf, dass ihm die (nach zwischenzeitlich erfolgtem in-camera-Verfahren, geänderter Sperrerklärung sowie anschließender Offenlegung bestimmter Informationen) noch streitgegenständlichen Unterlagen, die dem Bundesnachrichtendienst zu Adolf Eichmann vorliegen, zugänglich gemacht werden. Das Bundesverwaltungsgericht stellt fest, dass ein Anspruch aus dem Informationsfreiheitsgesetz aufgrund dessen Bereichsausnahme gegenüber den Nachrichtendiensten nicht hergeleitet werden kann.  Die Begründung des Urteils basiert im Wesentlichen auf dem Bundesarchivgesetz und enthält Ausführungen zum Verhältnis zwischen den fachgesetzlichen Versagungsgründen im Hauptsacheverfahren und dem Ergebnis des Zwischenverfahrens vor dem Fachsenat.","Anwendungsbereich/Zuständigkeit, Konkurrierende Rechtsvorschriften",http://www.lda.brandenburg.de/media_fast/5955/BVerwG_7_A_15_10.pdf,7,http://www.lda.brandenburg.de/sixcms/detail.php?template=rechtsprechungsdb_erg_d&sort=datum&order=desc&gerichte_title=&title=&sm[title]=tablescan&sm[vt_db]=fulltext_all&datum_von=&datum_bis=&art2_title=&vt_db=&max=&skip=120
Verwaltungsgericht Aachen,8 K 532/11,17.07.2013,Urteil,Informationsfreiheitsgesetz (Nordrhein-Westfalen),"Nach dem Informationsfreiheitsgesetz Nordrhein-Westfalen besteht ein Anspruch gegenüber dem Präsidenten eines Gerichts auf Überlassung des Telefonverzeichnisses des Gerichts einschließlich der Durchwahlnummern der Richterinnen und Richter. Das Telefonverzeichnis wurde in dienstlichem Zusammenhang erstellt und ist als amtliche Information anzusehen. Die richterliche Unabhängigkeit wird nicht tangiert. Die in der Telefonliste enthaltenen Namen und und dienstlichen Telefonnummern stellen zwar personenbezogene Daten dar, sind jedoch zu offenbaren, da der Antragsteller ein rechtliches Interesse an der begehrten Information geltend macht und überwiegende schutzwürdige Belange nicht entgegen stehen. Das rechtliche Interesse des antragstellenden Rechtsanwalts ergibt sich aus seiner Stellung als Organ der Rechtspflege; in welcher Weise er seine berufliche Aufgabe umsetzt und Telefonate mit Richtern führt, bleibt ihm überlassen. Da es sich nicht um sensitive Daten handelt, hat das Geheimhaltungsinteresse der Richter zurück zu stehen; die Schutzwürdigkeit von dienstlichen Telefonnummern rangiert am unteren Rand der denkbaren Möglichkeiten.","Anwendungsbereich/Zuständigkeit, Interessenabwägung, Personenbezogene Daten",http://www.lda.brandenburg.de/media_fast/5955/VG_Aachen_8_K_532_11.pdf,7,http://www.lda.brandenburg.de/sixcms/detail.php?template=rechtsprechungsdb_erg_d&sort=datum&order=desc&gerichte_title=&title=&sm[title]=tablescan&sm[vt_db]=fulltext_all&datum_von=&datum_bis=&art2_title=&vt_db=&max=&skip=120
Europäischer Gerichtshof,C-515/11,18.07.2013,Urteil,Richtlinie 2003/4/EG (Umweltinformationsrichtlinie),"Die Mitgliedstaaten können nach Art. 2 Nr. 2 Satz 2 der Umweltinformationsrichtlinie festlegen, dass der Begriff Behörde keine Gremien oder Einrichtungen umfasst, soweit sie in gesetzgebender Eigenschaft handeln. Der Gerichtshof hat bereits entschieden, dass die Bestimmung auf Ministerien angewandt werden kann, soweit sie am Gesetzgebungsverfahren im eigentlichen Sinne beteiligt sind. Die Regelung ist dahin auszulegen, dass sie nicht für Ministerien gelten kann, wenn sie Recht ausarbeiten und setzen, das im Rang unter einem Gesetz steht (etwa Verordnungen).  Für diese Auslegung sprechen Wortlaut und Systematik des Übereinkommens von Aarhus, das zwischen der Regelung für Gesetzgebungsakte und der Regelung für exekutive Rechtsakte unterscheidet. Während der ""Vorbereitung exekutiver Vorschriften"" sind Behörden verpflichtet eine effektive Öffentlichkeitsbeteiligung zu fördern.","Anwendungsbereich/Zuständigkeit, Begriffsbestimmung, Schutz besonderer Verfahren",http://www.lda.brandenburg.de/media_fast/5955/EuGH_C_515_11.pdf,7,http://www.lda.brandenburg.de/sixcms/detail.php?template=rechtsprechungsdb_erg_d&sort=datum&order=desc&gerichte_title=&title=&sm[title]=tablescan&sm[vt_db]=fulltext_all&datum_von=&datum_bis=&art2_title=&vt_db=&max=&skip=120
Bundesverwaltungsgericht,7 B 45.12,25.07.2013,Beschluss,Umweltinformationsgesetz (Rheinland-Pfalz),"Das Bundesverwaltungsgericht weist die Beschwerde gegen die Nichtzulassung der Revision zurück. Mit der - vermeintlich - fehlerhaften Anwendung bzw. unzureichenden Beachtung von Rechtssätzen, die sich auf höherrangiges Recht bzw. auf Unionsrecht beziehen, wird eine für die Zulassung der Revision erforderliche Divergenz nicht dargetan. Insbesondere bestätigt das Bundesverwaltungsgericht, dass es bei der Prüfung, ob offengelegte Informationen Rückschlüsse auf Betriebs- und Geschäftsgeheimnisse ermöglichen, auf eine Unterscheidung zwischen unmittelbaren und nur mittelbaren Rückschlüssen nicht ankommen kann. Die Schutzwürdigkeit und Schutzbedürftigkeit von Betriebs- und Geschäftsgeheimnissen bestimmt sich allein nach materiellen Kriterien.","Begriffsbestimmung, Betriebs- und Geschäftsgeheimnisse, Interessenabwägung, Prozessuales",http://www.lda.brandenburg.de/media_fast/5955/BVerwG_7_B_45_12.pdf,7,http://www.lda.brandenburg.de/sixcms/detail.php?template=rechtsprechungsdb_erg_d&sort=datum&order=desc&gerichte_title=&title=&sm[title]=tablescan&sm[vt_db]=fulltext_all&datum_von=&datum_bis=&art2_title=&vt_db=&max=&skip=120
