Gericht,Aktenzeichen,Datum,Art,Rechtsgrundlage,Text,Schlagwort,Urteil,pagination,pagination-href
Oberverwaltungsgericht Berlin-Brandenburg,12 N 97.10,26.01.2011,Beschluss,Informationsfreiheitsgesetz (Berlin),"Das Oberverwaltungsgericht lehnt eine Beschwerde gegen das Urteil des Verwaltungsgerichts Berlin zurück. Dieses hatte zutreffend festgestellt, dass die Einsicht in Unterlagen der Bezirksverwaltung zur Baumkontrolle nicht unter Verweis auf die Ausnahmetatbestände des § 9 Abs. 1 IFG Berlin verweigert werden kann. Die mögliche Vorbereitung von Amtshaftungsprozessen ist von diesen nicht erfasst. Der Anspruch auf Informationszugang besteht zudem unabhängig von einem darzulegenden Interesse.","Gefährdung des Erfolgs behördlicher Maßnahmen, Missbräuchliche Antragstellung, Schutz besonderer Verfahren",http://www.lda.brandenburg.de/media_fast/5955/OVG_BE_BB_12_N_97_10.pdf,17,http://www.lda.brandenburg.de/sixcms/detail.php?template=rechtsprechungsdb_erg_d&sort=datum&order=desc&gerichte_title=&title=&sm[title]=tablescan&sm[vt_db]=fulltext_all&datum_von=&datum_bis=&art2_title=&vt_db=&max=&skip=320
Oberverwaltungsgericht Berlin-Brandenburg,12 B 69.07,27.01.2011,Urteil,Informationsfreiheitsgesetz (Berlin),"Das Oberverwaltungsgericht bestätigt die Entscheidung der Vorinstanz im Hinblick auf einen Informationszugangsantrag zum vollständigen Geschäftsverteilungsplan sowie dem Aktenplan einer Senatsverwaltung. Das Verwaltungsgericht hat die Behörde zu Recht verpflichtet, Informationen über die Bewertungen von Stellen herauszugeben. Selbst wenn ein Personenbezug bestünde, überwöge das Informationsinteresse des Antragstellers. Dem Kläger steht zwar kein Anspruch auf die begehrten Informationen über Angaben zur Besoldungs-, Vergütungs- oder Lohngruppe der Stelleninhaber zu, der Antrag ist jedoch unter Beachtung der Rechtsauffassung des Gerichts erneut zu entscheiden. Im Hinblick auf die begehrte Ergänzung des zu veröffentlichenden Aktenplans wird die Berufung als unbegründet abgelehnt.","(Gesetzliche) Geheimhaltungspflichten, Interessenabwägung, Personenbezogene Daten, Veröffentlichung von Informationen",http://www.lda.brandenburg.de/media_fast/5955/OVG_BE_BB_12_B_69_07.pdf,17,http://www.lda.brandenburg.de/sixcms/detail.php?template=rechtsprechungsdb_erg_d&sort=datum&order=desc&gerichte_title=&title=&sm[title]=tablescan&sm[vt_db]=fulltext_all&datum_von=&datum_bis=&art2_title=&vt_db=&max=&skip=320
Verwaltungsgericht Arnsberg,7 K 753/10,27.01.2011,Urteil,Umweltinformationsgesetz (Nordrhein-Westfalen),"Die Stellungnahme des Landesamtes für Natur, Umwelt und Verbraucherschutz  zur Untersuchung und Auswertung von Proben im Zusammenhang mit Ablagerungen im Umfeld eines Glaswerks ist eine Umweltinformation. Der Verweis auf unwahre Informationen und fachliche Mängel in der Stellungnahme kommt als Begründung für die Herausgabe nicht in Betracht. Auch hat die Bekanntgabe der Informationen keine nachteiligen Auswirkungen auf die Durchführung eines laufenden Gerichtsverfahrens. Dieser Ausschlussgrund des Umweltinformationsgesetzes dient in erster Linie dem Schutz der Rechtspflege (ordnungsgemäßer Verfahrensablauf, Unabhängigkeit und Entscheidungsfreiheit der Rechtsorgane). Die eventuell aufgrund zusätzlicher Informationen ermöglichte Findung eines dann materiell richtigen Zivilrechtsurteils stellt keine solche negative Auswirkung dar. Geschützt werden soll die störungsfreie Durchführung eines laufenden Gerichtsverfahrens, nicht die Position von Prozessbeteiligten. Selbst anderenfalls würde eine Interessenabwägung vor dem Hintergrund möglicher oder tatsächlicher Umweltbeeinträchtigungen und Störfälle zu einer Offenlegung der Umweltinformationen führen.","Begriffsbestimmung, Interessenabwägung, Schutz besonderer Verfahren",http://www.lda.brandenburg.de/media_fast/5955/VG_Arnsberg_7_K_753_10.pdf,17,http://www.lda.brandenburg.de/sixcms/detail.php?template=rechtsprechungsdb_erg_d&sort=datum&order=desc&gerichte_title=&title=&sm[title]=tablescan&sm[vt_db]=fulltext_all&datum_von=&datum_bis=&art2_title=&vt_db=&max=&skip=320
Verwaltungsgericht Köln,6 K 4165/09,27.01.2011,Urteil,Informationsfreiheitsgesetz (Bund),"Das Verwaltungsgericht weist eine Klage gegen die Verweigerung der Herausgabe von Inhalten eines Mietvertrags zwischen der öffentlich-rechtlich organisierten Eigentümerin eines ehemaligen Flughafens und einem Messeveranstalter sowie der Höhe des Mietzinses ab. Zwar ist der Anspruch auf der Grundlage des Informationsfreiheitsgesetzes nicht schon deshalb ausgeschlossen, weil dem Antragsteller als Journalisten grundsätzlich ein presserechtlicher Anspruch zusteht. Es handelt sich jedoch um Geschäftsgeheimnisse, deren Offenlegung der Betroffene ausdrücklich widersprochen hat. Auch steht der Ausnahmetatbestand des Schutzes vor Beeinträchtigung fiskalischer Interessen des Bundes im Wirtschaftsverkehr der Herausgabe entgegen.","Betriebs- und Geschäftsgeheimnisse, Drittbetroffenheit, Fiskalische Interessen, Konkurrierende Rechtsvorschriften",http://www.lda.brandenburg.de/media_fast/5955/VG_Koeln_6_K_4165_09.pdf,17,http://www.lda.brandenburg.de/sixcms/detail.php?template=rechtsprechungsdb_erg_d&sort=datum&order=desc&gerichte_title=&title=&sm[title]=tablescan&sm[vt_db]=fulltext_all&datum_von=&datum_bis=&art2_title=&vt_db=&max=&skip=320
Oberverwaltungsgericht Saarland,3 A 270/10,03.02.2011,Beschluss,Verbraucherinformationsgesetz,"Das Oberverwaltungsgericht bestätigt eine Entscheidung der Vorinstanz zur Zulässigkeit der Information der Öffentlichkeit über Verstöße einer Bäckerei gegen Hygienevorschriften sowie die im Zusammenhang damit getroffene Maßnahme über das Internet unter Nennung des Unternehmens. Das Verbraucherinformationsgesetz erlaubt eine solche antragsunabhängige Veröffentlichung. Dies stellt auch keine Umgehung der restriktiveren Regelungen des Lebensmittel- und Futtermittelgesetzbuchs dar. Ziel des Verbraucherinformationsgesetzes ist die umfassende Information der Verbraucher auch ohne subjektiven Informationsanspruch. Der Information steht nicht entgegen, dass die festgestellten Mängel inzwischen beseitigt wurden.","Drittbetroffenheit, Interessenabwägung, Personenbezogene Daten, Veröffentlichung von Informationen",http://www.lda.brandenburg.de/media_fast/5955/OVG_SL_3_A_270_10.pdf,17,http://www.lda.brandenburg.de/sixcms/detail.php?template=rechtsprechungsdb_erg_d&sort=datum&order=desc&gerichte_title=&title=&sm[title]=tablescan&sm[vt_db]=fulltext_all&datum_von=&datum_bis=&art2_title=&vt_db=&max=&skip=320
Verwaltungsgericht Karlsruhe,3 K 14/11,08.02.2011,Beschluss,"Verbraucherinformationsgesetz, Sonstige","Das Gericht lehnt den Erlass einer einstweiligen Anordnung ab. Ein Journalist begehrt die Bekanntgabe der Titel der Kinderzeitschriften, in welchen ein Veterinäruntersuchungsamt in Kosmetikproben verbotene Farbstoffe festgestellt hatte. Es fehlt auch unter Berücksichtigung der Pressefreiheit an der Glaubhaftmachung eines schwer wiegenden Nachteils, der die Durchbrechung des Verbots der Vorwegnahme der Hauptsache rechtfertigen könnte. Der Gegenwartsbezug ist zu verneinen, da die Vorfälle über ein Jahr zurückliegen. Das Zuwarten auf die Entscheidung in der Hauptsache ist zumutbar.","Betriebs- und Geschäftsgeheimnisse, Konkurrierende Rechtsvorschriften, Prozessuales, Veröffentlichung von Informationen",http://www.lda.brandenburg.de/media_fast/5955/VG_Karlsruhe_3_K_14_11.pdf,16,http://www.lda.brandenburg.de/sixcms/detail.php?template=rechtsprechungsdb_erg_d&sort=datum&order=desc&gerichte_title=&title=&sm[title]=tablescan&sm[vt_db]=fulltext_all&datum_von=&datum_bis=&art2_title=&vt_db=&max=&skip=300
Bundesverwaltungsgericht,20 F 13.10,08.02.2011,"Beschluss des Fachsenats (""in-camera""-Verfahren)",§ 99 Abs. 2 Verwaltungsgerichtsordnung,"Der Fachsenat des Bundesverwaltungsgerichts weist die Beschwerde gegen die im Zwischenverfahren vor dem Oberverwaltungsgericht getroffene Feststellung der Rechtswidrigkeit einer Sperrerklärung des Innenministeriums zur Verweigerung der Vorlage bestimmter Unterlagen zur US-Cross-Border-Lease-Transaktion einer Stadt zurück. Da keine neuen Verträge dieser Art mehr geschlossen werden, erscheint das im Vertragswerk generierte Geschäftsgeheimnis als wirtschaftlich ""totes"" Wissen. Selbst wenn ein berechtigtes Geheimhaltungsinteresse anzuerkennen wäre, überwiegen die öffentlichen und privaten Offenbarungsinteressen. Maßstab für die prozessuale Entscheidung im Zwischenverfahren ist alleine die Regelung der Verwaltungsgerichtsordnung. Die Prüfung fachgesetzlicher Vorgaben obliegt dem Gericht der Hauptsache. Siehe auch Beschluss des Bundesverwaltungsgerichts vom selben Tag, AZ 20 F 14.10.","Betriebs- und Geschäftsgeheimnisse, Interessenabwägung, Prozessuales",http://www.lda.brandenburg.de/media_fast/5955/BVerwG_20_F_13_10.pdf,16,http://www.lda.brandenburg.de/sixcms/detail.php?template=rechtsprechungsdb_erg_d&sort=datum&order=desc&gerichte_title=&title=&sm[title]=tablescan&sm[vt_db]=fulltext_all&datum_von=&datum_bis=&art2_title=&vt_db=&max=&skip=300
Bundesverwaltungsgericht,20 F 14.10,08.02.2011,"Beschluss des Fachsenats (""in-camera""-Verfahren)",§ 99 Abs. 2 Verwaltungsgerichtsordnung,"Der Fachsenat des Bundesverwaltungsgerichts weist die Beschwerde gegen die im Zwischenverfahren vor dem Oberverwaltungsgericht getroffene Feststellung der Rechtswidrigkeit einer Sperrerklärung des Innenministeriums zur Verweigerung der Vorlage bestimmter Unterlagen zur US-Cross-Border-Lease-Transaktion einer Stadt zurück. Da keine neuen Verträge dieser Art mehr geschlossen werden, erscheint das im Vertragswerk generierte Geschäftsgeheimnis als wirtschaftlich ""totes"" Wissen. Selbst wenn ein berechtigtes Geheimhaltungsinteresse anzuerkennen wäre, überwiegen die öffentlichen und privaten Offenbarungsinteressen. Maßstab für die prozessuale Entscheidung im Zwischenverfahren ist alleine die Regelung der Verwaltungsgerichtsordnung. Die Prüfung fachgesetzlicher Vorgaben obliegt dem Gericht der Hauptsache. Siehe auch Beschluss des Bundesverwaltungsgerichts vom selben Tag, AZ 20 F 13.10.","Betriebs- und Geschäftsgeheimnisse, Interessenabwägung, Prozessuales",http://www.lda.brandenburg.de/media_fast/5955/BVerwG_20_F_14_10.pdf,17,http://www.lda.brandenburg.de/sixcms/detail.php?template=rechtsprechungsdb_erg_d&sort=datum&order=desc&gerichte_title=&title=&sm[title]=tablescan&sm[vt_db]=fulltext_all&datum_von=&datum_bis=&art2_title=&vt_db=&max=&skip=320
Verwaltungsgericht Berlin,2 K 23.10,10.02.2011,Urteil,Informationsfreiheitsgesetz (Bund),"Das Informationsfreiheitsgesetz sieht keinen Anspruch auf Informationszugang vor, wenn das Bekanntwerden der Information nachteilige Auswirkungen haben kann auf Belange der inneren und äußeren Sicherheit. Mögliche Anschläge von Terroristen auf Infrastruktureinrichtungen des Bundes fallen in den Schutzbereich dieser Bestimmung. Was den Grad der Gewissheit über die nachteiligen Auswirkungen betrifft, lässt die Vorschrift die Möglichkeit ausreichen. Eine entsprechende Prognose muss plausibel und nachvollziehbar sein, ist aber nur in engen Grenzen verwaltungsgerichtlich überprüfbar. Informationen über bestimmte Angaben aus der ""Bauwerksdatenbank Bundesfernstraßen"" werden deshalb zu Recht geheimgehalten. Darüber hinaus sind sie in berechtigter Weise als Verschlusssache eingestuft worden und deshalb ebenfalls nicht zugänglich.","(Gesetzliche) Geheimhaltungspflichten, Sicherheitsaspekte",http://www.lda.brandenburg.de/media_fast/5955/VG_Berlin_2_K_23_10.pdf,16,http://www.lda.brandenburg.de/sixcms/detail.php?template=rechtsprechungsdb_erg_d&sort=datum&order=desc&gerichte_title=&title=&sm[title]=tablescan&sm[vt_db]=fulltext_all&datum_von=&datum_bis=&art2_title=&vt_db=&max=&skip=300
Oberverwaltungsgericht Nordrhein-Westfalen,8 A 2861/07,01.03.2011,Urteil,Umweltinformationsgesetz (Nordrhein-Westfalen),"Das Oberverwaltungsgericht ändert das Urteil der Vorinstanz. Es stellt fest, dass sich Agrarsubventionen mittelbar auf die Umwelt auswirken könnten und als Umweltinformationen zu verstehen sind. Das Umweltinformationsgesetz ist als Anspruchsgrundlage anzuwenden. Natürliche Personen, die von der Offenlegung betroffen sind, müssen zwar zur Wahrung ihrer Datenschutzrechte angehört werden, Unternehmen können sich im Hinblick auf den Erhalt von Agrarsubventionen jedoch nicht auf Betriebs- und Geschäftsgeheimnisse berufen.","Begriffsbestimmung, Drittbetroffenheit, Konkurrierende Rechtsvorschriften, Personenbezogene Daten",http://www.lda.brandenburg.de/media_fast/5955/OVG_NW_8_A_2861_07.pdf,16,http://www.lda.brandenburg.de/sixcms/detail.php?template=rechtsprechungsdb_erg_d&sort=datum&order=desc&gerichte_title=&title=&sm[title]=tablescan&sm[vt_db]=fulltext_all&datum_von=&datum_bis=&art2_title=&vt_db=&max=&skip=300
Oberverwaltungsgericht Nordrhein-Westfalen,8 A 3358/08,01.03.2011,Urteil,Umweltinformationsgesetz (Bund),"Das Oberverwaltungsgericht Nordrhein-Westfalen ändert das Urteil der Vorinstanz zur Frage der Offenlegung der Empfänger von Agrarsubventionen. Es stellt fest, dass sich Agrarsubventionen mittelbar auf die Umwelt auswirken können und als Umweltinformation zu verstehen sind. Das Umweltinformationsgesetz ist als Anspruchsgrundlage anzuwenden, allerdings ergibt sich bei Anwendung des Informationsfreiheitsgesetzes kein anderes Ergebnis. Während personenbezogene Daten nur unter Zustimmung der Betroffenen offengelegt werden können, handelt es sich bei der Angabe, ob eine juristische Person Subventionszahlungen erhält, aber nicht um ein Betriebs- oder Geschäftsgeheimnis. Siehe auch folgende Entscheidungen des Oberverwaltungsgerichts Nordrhein-Westfalen: 8 A 3357/08 und 8 A 2861/07 vom 1. März 2011.","Begriffsbestimmung, Betriebs- und Geschäftsgeheimnisse, Drittbetroffenheit, Konkurrierende Rechtsvorschriften, Personenbezogene Daten",http://www.lda.brandenburg.de/media_fast/5955/OVG_NW_8_A_3358_08.pdf,16,http://www.lda.brandenburg.de/sixcms/detail.php?template=rechtsprechungsdb_erg_d&sort=datum&order=desc&gerichte_title=&title=&sm[title]=tablescan&sm[vt_db]=fulltext_all&datum_von=&datum_bis=&art2_title=&vt_db=&max=&skip=300
Oberverwaltungsgericht Nordrhein-Westfalen,8 A 3357/08,01.03.2011,Urteil,Umweltinformationsgesetz (Bund),"Das Oberverwaltungsgericht Nordrhein-Westfalen ändert das Urteil der Vorinstanz zur Frage der Offenlegung der Empfänger von Agrarsubventionen. Es stellt fest, dass sich Agrarsubventionen mittelbar auf die Umwelt auswirken können und als Umweltinformation zu verstehen sind. Das Umweltinformationsgesetz ist als Anspruchsgrundlage anzuwenden, allerdings ergibt sich bei Anwendung des Informationsfreiheitsgesetzes kein anderes Ergebnis. Während personenbezogene Daten nur unter Zustimmung der Betroffenen offengelegt werden können, handelt es sich bei der Angabe, ob eine juristische Person Subventionszahlungen erhält aber nicht um ein Betriebs- oder Geschäftsgeheimnis. Siehe auch folgende Entscheidungen des Oberverwaltungsgerichts Nordrhein-Westfalen: 8 A 2861/07 und 8 A 3358/08 vom 01.03.2011.","Begriffsbestimmung, Betriebs- und Geschäftsgeheimnisse, Drittbetroffenheit, Konkurrierende Rechtsvorschriften, Personenbezogene Daten",http://www.lda.brandenburg.de/media_fast/5955/OVG_NW_8_A_3357_08.pdf,16,http://www.lda.brandenburg.de/sixcms/detail.php?template=rechtsprechungsdb_erg_d&sort=datum&order=desc&gerichte_title=&title=&sm[title]=tablescan&sm[vt_db]=fulltext_all&datum_von=&datum_bis=&art2_title=&vt_db=&max=&skip=300
Gericht der Europäischen Union,T-233/09,22.03.2011,Urteil,Verordnung (EG) Nr. 1049/2001 (Transparenzverordnung),"Dass die Offenlegung der Identität der Mitgliedsstaaten, die sich im Rat der Europäischen Union zur Novellierung der Verordnung (EG) Nr. 1049/2001 (Transparenzverordnung) positioniert haben, geeignet sein könnte, den Entscheidungsprozess zu beeinträchtigen, hat der Rat in seiner Begründung zur Ablehnung eines entsprechenden Informationszugangsantrags nicht in nachvollziehbarer Weise dargelegt. Insbesondere in einem Verfahren, in dem die Organe als Gesetzgeber tätig werden, sind die Ausnahmen der Transparenzverordnung eng auszulegen. Das Gericht erklärt die angefochtene Ablehnungsentscheidung des Rates für nichtig.",Beratungsgeheimnis (behördlicher Entscheidungsprozess),http://www.lda.brandenburg.de/media_fast/5955/EuG_T_233_09.pdf,16,http://www.lda.brandenburg.de/sixcms/detail.php?template=rechtsprechungsdb_erg_d&sort=datum&order=desc&gerichte_title=&title=&sm[title]=tablescan&sm[vt_db]=fulltext_all&datum_von=&datum_bis=&art2_title=&vt_db=&max=&skip=300
Gericht der Europäischen Union,T-36/10,24.03.2011,Beschluss,Verordnung (EG) Nr. 1049/2001 (Transparenzverordnung),"Teilt die Kommission dem Antragsteller innerhalb der in der Verordnung Nr. 1049/2001 festgelegten Bearbeitungsfrist von 15 Tagen mit, dass der Antrag auf Akteneinsicht noch nicht abschließend beantwortet werden könne, so ist dieses Schweigen einer stillschweigenden ablehnenden Entscheidung über den Antrag gleichzustellen, gegen die Klage erhoben werden kann. Durch eine spätere tatsächliche Beantwortung des Antrags wird die stillschweigende ablehnende Entscheidung zurückgenommen. Das Gericht beschäftigt sich ausführlich mit Zulässigkeitsproblemen der Klage, wie dem Fristablauf zur Klageerhebung und der Erledigung.","Bearbeitungsfrist, Durchführung des Antragsverfahrens, Prozessuales",http://www.lda.brandenburg.de/media_fast/5955/EuG_T_36_10.pdf,16,http://www.lda.brandenburg.de/sixcms/detail.php?template=rechtsprechungsdb_erg_d&sort=datum&order=desc&gerichte_title=&title=&sm[title]=tablescan&sm[vt_db]=fulltext_all&datum_von=&datum_bis=&art2_title=&vt_db=&max=&skip=300
Verwaltungsgericht Potsdam,9 K 1793/08,24.03.2011,Urteil,Akteneinsichts- und Informationszugangsgesetz (Brandenburg),"Akten der Sparkassenaufsichtsbehörde zur Fusion zweier Sparkassen unterfallen dem Ausschlussgrund des § 4 Abs. 1 Nr. 5 Akteneinsichts- und Informationszugangsgesetz. Das Gericht stellt fest, dass die Verwendung der Gegenwartsform im Gesetzestext (der Aufsicht über eine andere Stelle ""dienen"") nicht zu einer anderen Bewertung führt, da die Akten auch dann noch für die Sparkassenaufsicht von Bedeutung sein können, wenn das Genehmigungsverfahren für sich genommen abgeschlossen ist. Das durch das Akteneinsichts- und Informationszugangsgesetzt geschützte öffentliche Interesse an der Aufsicht wird durch den Abschluss einzelner Aufsichtsmaßnahmen somit nicht hinfällig.",Aufsichtsaufgaben,http://www.lda.brandenburg.de/media_fast/5955/VG_Potsdam_9_K_1793_08.pdf,16,http://www.lda.brandenburg.de/sixcms/detail.php?template=rechtsprechungsdb_erg_d&sort=datum&order=desc&gerichte_title=&title=&sm[title]=tablescan&sm[vt_db]=fulltext_all&datum_von=&datum_bis=&art2_title=&vt_db=&max=&skip=300
Oberverwaltungsgericht Sachsen,5 D 203/10,25.03.2011,Beschluss,Informationsfreiheitsgesetz (Bund),"Das Oberverwaltungsgericht lehnt die Beschwerde gegen die Nichtbewilligung von Prozesskostenhilfe ab und bestätigt die Feststellung des Verwaltungsgerichts, dass die beklagte landesunmittelbare Körperschaft des öffentlichen Rechts nicht dem Anwendungsbereich des Informationsfreiheitsgesetzes des Bundes unterfällt.",Anwendungsbereich/Zuständigkeit,http://www.lda.brandenburg.de/media_fast/5955/OVG_SN_5_D_203_10.pdf,16,http://www.lda.brandenburg.de/sixcms/detail.php?template=rechtsprechungsdb_erg_d&sort=datum&order=desc&gerichte_title=&title=&sm[title]=tablescan&sm[vt_db]=fulltext_all&datum_von=&datum_bis=&art2_title=&vt_db=&max=&skip=300
Verwaltungsgericht Köln,13 K 2920/08,31.03.2011,Urteil,Informationsfreiheitsgesetz (Bund),"Der Kläger begehrt Zugang zu Qualitätsberichten von Krankenhäusern auf Grundlage des Sozialgesetzbuchs, Fünftes Buch (SGB V) im XML-Format vom Gemeinsamen Bundesausschuss. Zwar wäre das Informationsfreiheitsgesetz auf den Gemeinsamen Bundesausschuss anwendbar, es wird jedoch vorliegend durch § 137 SGB V als Regelung in einer anderen Rechtsvorschrift über den Zugang zu amtlichen Informationen verdrängt. Da diese Norm speziell den Zugang zu  den Qualitätsberichten der Krankhäuser regelt, geht diese Regelung den Vorschriften des Informationsfreiheitsgesetzes vor. Aber selbst wenn das Informationsfreiheitsgesetz anwendbar wäre, wäre der Anspruch auf Zugang zu den Berichten im XML-Format aus wichtigem Grund abzulehnen, da der Kläger bereits in einem anderen Format über die Berichte verfügt und ein wichtiger Grund für eine andere Art der Informationsgewährung in der Vermeidung der Gefahren, die mit der Weiterverarbeitung der Qualitätsberichte verbunden sind, besteht.","Anwendungsbereich/Zuständigkeit, Veröffentlichung von Informationen",http://www.lda.brandenburg.de/media_fast/5955/VG_Koeln_13_K_2920_08_.pdf,16,http://www.lda.brandenburg.de/sixcms/detail.php?template=rechtsprechungsdb_erg_d&sort=datum&order=desc&gerichte_title=&title=&sm[title]=tablescan&sm[vt_db]=fulltext_all&datum_von=&datum_bis=&art2_title=&vt_db=&max=&skip=300
Bundesverwaltungsgericht,20 F 20.10,06.04.2011,"Beschluss des Fachsenats (""in-camera""-Verfahren)",§ 99 Abs. 2 Verwaltungsgerichtsordnung,"In Rede stehen Informationen des Bundesverwaltungsamtes über einen Verein, dessen Zweck die Verbreitung der sogenannten Scientology-Religion ist.  Dessen Aufsichtsbehörde, das Bundesministerium für Familie, Senioren, Frauen und Jugend, erließ eine Anordnung zur Verweigerung der Aktenvorlage an das Hauptsachegericht. Diese Sperrerklärung erklärt das Bundesverwaltungsgericht für rechtswidrig. Die darin angeführten Geheimhaltungsgründe sind den verschiedenen Aktenbestandteilen zu pauschal und nicht hinreichend zugeordnet sowie nicht ausreichend belegt. Die gebotene Bewertung des Geheimhaltungsbedarfs kann der Fachsenat nicht originär anstelle der dazu berufenen obersten Aufsichtsbehörde vornehmen. Dies muss vielmehr in der Sperrerklärung geleistet werden.","(Gesetzliche) Geheimhaltungspflichten, Ablehnungsbegründung, Beratungsgeheimnis (behördlicher Entscheidungsprozess), Exekutiver Kernbereich (Regierungshandeln), Personenbezogene Daten, Sicherheitsaspekte",http://www.lda.brandenburg.de/media_fast/5955/BVerwG_20_F_20.10_110406.pdf,16,http://www.lda.brandenburg.de/sixcms/detail.php?template=rechtsprechungsdb_erg_d&sort=datum&order=desc&gerichte_title=&title=&sm[title]=tablescan&sm[vt_db]=fulltext_all&datum_von=&datum_bis=&art2_title=&vt_db=&max=&skip=300
Verwaltungsgericht Köln,13 K 822/10,07.04.2011,Urteil,Informationsfreiheitsgesetz (Bund),"Die Veräußerung von Liegenschaften ist zwar insgesamt dem fiskalischen Handeln des Bundes zuzuordnen. Das Schutzgut der ""fiskalischen Interessen des Bundes im Wirtschaftsverkehr"" aus dem Informationsfreiheitsgesetz umfasst diesen Vorgang jedoch nicht. Geschützt ist vielmehr das Ziel einer Bestimmung der Bundeshaushaltsordnung, nach der Liegenschaften nur zum vollen Wert veräußert werden. Eine Beeinträchtigung kann jedoch nicht mehr erfolgen, da im vorliegenden Fall die Veräußerung abgeschlossen ist. Auch eine Beeinträchtigung künftiger Grundstücksverkäufe ist nicht ausreichend dargelegt. Nach den Grundsätzen der engen Auslegung der Versagungsgründe muss die drohende Beeinträchtigung von hinreichender Wahrscheinlichkeit und hinreichendem Gewicht sein.","Begriffsbestimmung, Fiskalische Interessen",http://www.lda.brandenburg.de/media_fast/5955/VG_Koeln_13_K_822_10.pdf,16,http://www.lda.brandenburg.de/sixcms/detail.php?template=rechtsprechungsdb_erg_d&sort=datum&order=desc&gerichte_title=&title=&sm[title]=tablescan&sm[vt_db]=fulltext_all&datum_von=&datum_bis=&art2_title=&vt_db=&max=&skip=300
Verwaltungsgericht Berlin,2 K 39.10,07.04.2011,Urteil,Informationsfreiheitsgesetz (Bund),"Die Gästeliste der Bundeskanzlerin anlässlich der von ihr veranstalteten Geburtstagsfeier für den Vorstandsvorsitzenden einer Bank sowie weitere Informationen in diesem Zusammenhang sind offenzulegen. Die Organisation der Feier ist nicht Teil der Regierungstätigkeit; das Informationsinteresse der Kläger überwiegt das Geheimhaltungsinteresse auch jener Eingeladenen, die einer Weitergabe ihrer Namen nicht zugestimmt haben. Zur Herausgabe des Terminkalenders der Bundeskanzlerin besteht jedoch keine Verpflichtung, da nachteilige Auswirkungen auf Belange der innern und äußern Sicherheit plausibel dargelegt wurden.","Begriffsbestimmung, Exekutiver Kernbereich (Regierungshandeln), Interessenabwägung, Personenbezogene Daten, Sicherheitsaspekte",http://www.lda.brandenburg.de/media_fast/5955/VG_Berlin_2_K_39_10.pdf,16,http://www.lda.brandenburg.de/sixcms/detail.php?template=rechtsprechungsdb_erg_d&sort=datum&order=desc&gerichte_title=&title=&sm[title]=tablescan&sm[vt_db]=fulltext_all&datum_von=&datum_bis=&art2_title=&vt_db=&max=&skip=300
Oberverwaltungsgericht Berlin-Brandenburg,95 A 1.11,21.04.2011,"Beschluss des Fachsenats (""in-camera""-Verfahren)",§ 99 Abs. 2 Verwaltungsgerichtsordnung,"Das Oberverwaltungsgericht verweist den Rechtsstreit über die Rechtmäßigkeit der Weigerungserklärung des Bundesministeriums des Innern an den Fachsenat des Bundesverwaltungsgerichts. Dieses entscheidet stets, wenn eine oberste Bundesbehörde die Aktenvorlage mit der Begründung verweigert, das Bekanntwerden ihres Inhalts würde dem wohl des Bundes Nachteile bereiten.",Prozessuales,http://www.lda.brandenburg.de/media_fast/5955/OVG_BB_95_A_1_11.pdf,16,http://www.lda.brandenburg.de/sixcms/detail.php?template=rechtsprechungsdb_erg_d&sort=datum&order=desc&gerichte_title=&title=&sm[title]=tablescan&sm[vt_db]=fulltext_all&datum_von=&datum_bis=&art2_title=&vt_db=&max=&skip=300
