Gericht,Aktenzeichen,Datum,Art,Rechtsgrundlage,Text,Schlagwort,Urteil,pagination,pagination-href
Bundesverwaltungsgericht,7 B 37.07,01.11.2007,Beschluss,"Informationsfreiheitsgesetz (Schleswig-Holstein), Umweltinformationsgesetz (Schleswig-Holstein)","Das Bundesverwaltungsgericht weist die Beschwerde gegen die Nichtzulassung der Revision durch das Oberverwaltungsgericht zurück. Der Kläger begehrt die Einsicht in Unterlagen zu einem geplanten Flughafenausbau, dessen Verwirklichung aufgegeben wurde. Der Begriff der Umweltinformation umfasst keine Pläne,  die bereits vor ihrer  Verwirklichung aufgegeben wurden. Das Umweltinformationsgesetz Schleswig-Holstein definiert den Begriff des Bereithaltens nicht enger als die Umweltinformationsrichtlinie gemeinschaftsrechtlich vorgibt. Informationen werden danach für eine Behörde bereitgehalten, wenn sie bei einer selbst nicht informationspflichtigen Stelle angefallen sind und von dieser für eine Behörde aufbewahrt werden, die einen Anspruch auf Übermittlung dieser Information hat.","Anwendungsbereich/Zuständigkeit, Begriffsbestimmung, Prozessuales",http://www.lda.brandenburg.de/media_fast/5955/BVerwG_7_B_37_07.pdf,26,http://www.lda.brandenburg.de/sixcms/detail.php?template=rechtsprechungsdb_erg_d&sort=datum&order=desc&gerichte_title=&title=&sm[title]=tablescan&sm[vt_db]=fulltext_all&datum_von=&datum_bis=&art2_title=&vt_db=&max=&skip=500
Gericht der Europäischen Union,T-194/04,08.11.2007,Urteil,Verordnung (EG) Nr. 1049/2001 (Transparenzverordnung),"Beantragt die Öffentlichkeit den Zugang zu Dokumenten, für die personenbezogene Daten übermittelt werden müssen, so richtet sich die rechtliche Würdigung nach der Transparenzverordnung mit der Folge, dass die Notwendigkeit der Verarbeitung im Sinne der Verordnung Nr. 45/2001 entfällt.Grundsätzlich steht dem von der Übermittlung der personenbezogenen Daten Betroffenen ebenso wenig ein Widerrufsrecht nach der Verordnung Nr. 45/2001 zu. Allerdings sind deren Bestimmungen im Lichte der Grundrechte zu betrachten. Bei einer Teilnahme im Rahmen der beruflichen Tätigkeit als Vertreter einer Vereinigung stellt die Offenlegung des Namens keinen Eingriff in die Privatsphäre der betroffenen natürlichen Person dar. Die Ausnahmevorschrift zum Schutz von Inspektions-, Untersuchungs- und Audittätigkeiten soll nicht die Untersuchungstätigkeiten an sich, sondern deren Zweck schützen. Ist das Verfahren bereits eingestellt, kann ein Zweck nicht mehr vereitelt werden, so dass die Voraussetzungen der Ausnahmevorschrift nicht erfüllt sein können.","(Gesetzliche) Geheimhaltungspflichten, Aussonderungen, Konkurrierende Rechtsvorschriften, Personenbezogene Daten",http://www.lda.brandenburg.de/media_fast/5955/EuG_T_194_04.pdf,26,http://www.lda.brandenburg.de/sixcms/detail.php?template=rechtsprechungsdb_erg_d&sort=datum&order=desc&gerichte_title=&title=&sm[title]=tablescan&sm[vt_db]=fulltext_all&datum_von=&datum_bis=&art2_title=&vt_db=&max=&skip=500
Verwaltungsgericht Frankfurt (Oder),3 K 2480/03,13.11.2007,Urteil,Akteneinsichts- und Informationszugangsgesetz (Brandenburg),"Das Akteneinsichts- und Informationszugangsgesetz findet auf Zweckverbände ohne weiteres Anwendung. Der Offenlegung von Protokollen der öffentlichen Vorstandssitzungen und Verbandsversammlungen steht das Steuergeheimnis schon deshalb nicht entgegen, weil in den Sitzungen keine unmittelbar der Abgabenerhebung unterfallenden Vorgänge behandelt werden. Das Gericht erkennt zudem keine Ausschlussgründe zum Schutz überwiegender öffentlicher oder privater Belange, die den Informationszugang beschränken. Die Behörde trägt hierzu außerdem die Beweislast. Selbst wenn, was vom Beklagten nicht geltend gemacht wurde, Informationen über den behördlichen Willensbildungsprozess in den Protokollen vorhanden sein sollten, kann keinesfalls der gesamte Inhalt per se als Darstellung des behördlichen Willensbildungsprozesses angesehen werden. Die entsprechende Ausschlussregelung schützt lediglich den engeren Beratungsvorgang, nicht die ihm zugrundeliegenden Sachinformationen.","Ablehnungsbegründung, Anwendungsbereich/Zuständigkeit, Beratungsgeheimnis (behördlicher Entscheidungsprozess)",http://www.lda.brandenburg.de/media_fast/5955/VG_Frankfurt_Oder_3_K_2480_03.pdf,26,http://www.lda.brandenburg.de/sixcms/detail.php?template=rechtsprechungsdb_erg_d&sort=datum&order=desc&gerichte_title=&title=&sm[title]=tablescan&sm[vt_db]=fulltext_all&datum_von=&datum_bis=&art2_title=&vt_db=&max=&skip=500
Verwaltungsgericht Schleswig-Holstein,12 A 37/06,29.11.2007,Urteil,Umweltinformationsgesetz (Schleswig-Holstein),"Der Öffentlichkeit steht auf der Grundlage des Schleswig-Holsteinischen Umweltinformationsgesetzes grundsätzlich ein Auskunftsanspruch über die Verwendung von Agrarsubventionen der Europäischen Union zu. Dies schließt die Nennung der Subventionsempfänger ein. Auch ein mittelbarer Umweltbezug genügt demnach, um die Voraussetzungen für das Vorliegen einer ""Umweltinformation"" zu erfüllen. Im Hinblick auf den eventuellen Schutzbedarf personenbezogener Daten oder von Betriebs- und Geschäftsgeheimnissen ist im Rahmen der Abwägung zu berücksichtigen, dass ein sehr großes öffentliches Interesse an der Aufklärung der Rechtmäßigkeit der Verwendung öffentlicher Mittel besteht. Sollten keine gravierenden Gründe im Einzelfall gegen die Veröffentlichung sprechen, dürfte das öffentliche Interesse überwiegen.","Begriffsbestimmung, Betriebs- und Geschäftsgeheimnisse, Interessenabwägung, Personenbezogene Daten",http://www.lda.brandenburg.de/media_fast/5955/VG_Schleswig_Holstein_12_A_37_06.pdf,26,http://www.lda.brandenburg.de/sixcms/detail.php?template=rechtsprechungsdb_erg_d&sort=datum&order=desc&gerichte_title=&title=&sm[title]=tablescan&sm[vt_db]=fulltext_all&datum_von=&datum_bis=&art2_title=&vt_db=&max=&skip=500
Verwaltungsgericht Saarland,10 K 1140/07,04.12.2007,Beschluss,Informationsfreiheitsgesetz (Bund),"Zur Begründung der Versagung der begehrten Prozesskostenhilfe verweist das Verwaltungsgericht auf seine örtliche Unzuständigkeit. Der Anspruch auf Informationserteilung ist gegenüber derjenigen Behörde anzubringen, die zuständigkeitshalber im Besitz der gewünschten Informationen ist. Deren Sitz (vorliegend in einem anderen Bundesland) ist maßgeblich für die örtliche Zuständigkeit des Gerichts.",Prozessuales,http://www.lda.brandenburg.de/media_fast/5955/VG_Saarland_10_K_1140_07.pdf,26,http://www.lda.brandenburg.de/sixcms/detail.php?template=rechtsprechungsdb_erg_d&sort=datum&order=desc&gerichte_title=&title=&sm[title]=tablescan&sm[vt_db]=fulltext_all&datum_von=&datum_bis=&art2_title=&vt_db=&max=&skip=500
Oberverwaltungsgericht Nordrhein-Westfalen,13a F 27/07,21.12.2007,"Beschluss des Fachsenats (""in-camera""-Verfahren)","Umweltinformationsgesetz (Bund), § 99 Abs. 2 Verwaltungsgerichtsordnung","Ein Bundesministerium hatte keine ausdrückliche Sperrerklärung nach § 99 Abs. 1 Satz 2 VwGO abgegeben, verweigerte aber die Vorlage der Akten im Hauptsacheverfahren. Das Oberverwaltungsgericht hat entschieden, dass die Weigerung der Vorlage vollständig ungeschwärzter Verwaltungsvorgänge nicht auf das Umweltinformationsgesetz gestützt werden kann und deshalb rechtswidrig ist. Die Regelungen des § 99 VwGO überlagern die des Fachgesetzes. Die gerichtliche Überprüfung der Verweigerung der Aktenvorlage hängt nicht von einer formellen Entscheidung nach § 99 Abs. 1 Satz 2 VwGO ab. Auch ist die Behörde nicht gehindert, die Sperr- oder Freigabeerklärung nachzuholen.",Konkurrierende Rechtsvorschriften,http://www.lda.brandenburg.de/media_fast/5955/OVG_NW_13a_F_27_07.pdf,26,http://www.lda.brandenburg.de/sixcms/detail.php?template=rechtsprechungsdb_erg_d&sort=datum&order=desc&gerichte_title=&title=&sm[title]=tablescan&sm[vt_db]=fulltext_all&datum_von=&datum_bis=&art2_title=&vt_db=&max=&skip=500
Oberverwaltungsgericht Nordrhein-Westfalen,13a F 30/07,07.01.2008,"Beschluss des Fachsenats (""in-camera""-Verfahren)","Umweltinformationsgesetz (Bund), § 99 Abs. 2 Verwaltungsgerichtsordnung","Ein Bundesministerium hatte keine ausdrückliche Sperrerklärung nach § 99 Abs. 1 Satz 2 VwGO abgegeben, verweigerte aber die Vorlage der Akten im Hauptsacheverfahren. Das Oberverwaltungsgericht hat entschieden, dass die Weigerung der Vorlage vollständig ungeschwärzter Verwaltungsvorgänge nicht auf das Umweltinformationsgesetz gestützt werden kann und deshalb rechtswidrig ist. Die Regelungen des § 99 VwGO überlagern die des Fachgesetzes. Die gerichtliche Überprüfung der Verweigerung der Aktenvorlage hängt nicht von einer formellen Entscheidung nach § 99 Abs. 1 Satz 2 VwGO ab. Auch ist die Behörde nicht gehindert, die Sperr- oder Freigabeerklärung nachzuholen.",Konkurrierende Rechtsvorschriften,http://www.lda.brandenburg.de/media_fast/5955/OVG_NW_13a_F_30_07.pdf,26,http://www.lda.brandenburg.de/sixcms/detail.php?template=rechtsprechungsdb_erg_d&sort=datum&order=desc&gerichte_title=&title=&sm[title]=tablescan&sm[vt_db]=fulltext_all&datum_von=&datum_bis=&art2_title=&vt_db=&max=&skip=500
Verwaltungsgericht Saarland,5 K 130/05,16.01.2008,Urteil,Informationsfreiheitsgesetz (Saarland),"Ob der Kläger einen Anspruch auf Zugang hat, richtet sich nach dem Recht, das zum Zeitpunkt der Entscheidung des Gerichts gilt; unerheblich ist deshalb, dass zum Zeitpunkt der Antragstellung das Saarländische Umweltinformationsgesetz noch nicht in Kraft getreten war. Der Kläger hat einen Anspruch auf Einsichtnahme in das sein Anwesen betreffende Grubenbild einschließlich der Erstellung von Kopien aus diesen Unterlagen. Bei diesen handelt es sich um Umweltinformationen im Sinne des Umweltinformationsgesetzes. Die Frage des Eigentums an den das Grubenbild wiedergebenden Unterlagen spielt für das Bestehen des umweltinformationsrechtlichen Zugangsanspruchs keine Rolle. Das Bundesberggesetz ist hinsichtlich der Frage des Zugangs zu Umweltinformationen kein Spezialgesetz, sondern tritt hinter dem erst später in Kraft getretenen Umweltinformationsgesetz zurück.","Begriffsbestimmung, Betriebs- und Geschäftsgeheimnisse, Fotokopien, Konkurrierende Rechtsvorschriften, Missbräuchliche Antragstellung, Personenbezogene Daten, Schutz besonderer Verfahren",http://www.lda.brandenburg.de/media_fast/5955/VG_Saarland_5_K_130_05.pdf,26,http://www.lda.brandenburg.de/sixcms/detail.php?template=rechtsprechungsdb_erg_d&sort=datum&order=desc&gerichte_title=&title=&sm[title]=tablescan&sm[vt_db]=fulltext_all&datum_von=&datum_bis=&art2_title=&vt_db=&max=&skip=500
Verwaltungsgericht Berlin,2 A 68.06,16.01.2008,Urteil,Informationsfreiheitsgesetz (Bund),"Gegenstand des Antrags auf Informationszugang waren Aktenvorgänge des Bundesjustizministerium zu einem abgeschlossenen Gesetzgebungsvorhaben für ein Rechtsanwaltsvergütungsgesetz. Das Verwaltungsgericht stellt fest, dass das Bundesjustizministerium bei der in Frage stehenden Tätigkeit der Ausarbeitung und Vorbereitung einer Gesetzesvorlage der Bundesregierung nicht dem Behördenbegriff des Informationsfreiheitsgesetzes unterfällt. Es handelt sich vielmehr um die Wahrnehmung von Regierungsaufgaben.","Anwendungsbereich/Zuständigkeit, Begriffsbestimmung, Exekutiver Kernbereich (Regierungshandeln)",http://www.lda.brandenburg.de/media_fast/5955/VG_Berlin_2_A_68_06.pdf,26,http://www.lda.brandenburg.de/sixcms/detail.php?template=rechtsprechungsdb_erg_d&sort=datum&order=desc&gerichte_title=&title=&sm[title]=tablescan&sm[vt_db]=fulltext_all&datum_von=&datum_bis=&art2_title=&vt_db=&max=&skip=500
Verwaltungsgericht Frankfurt am Main,7 E 3280/06,23.01.2008,Urteil,Informationsfreiheitsgesetz (Bund),"Die Klägerin begehrte gegenüber der Bundesanstalt für Finanzdienstleistungsaufsicht Zugang zu Informationen aus einem Verfahren wegen Verdachts des Verstoßes gegen Pflichten aus dem Wertpapierhandelsgesetz. Das Verwaltungsgericht stellt fest, dass ein Verweis auf nicht von vornherein auszuschließende, abstrakt gegebene nachteilige Auswirkungen auf die Kontroll- und Aufsichtsaufgaben der Beklagten nicht ausreicht, um den Informationszugang zu verweigern. Die im Wertpapierhandelsgesetz enthaltene Verschwiegenheitspflicht bezweckt die Wahrung der berechtigten Interessen der beaufsichtigten Institute und ihrer Kunden. Der Anwendungsbereich dieser Vorschriften erfasst aber nicht sämtliche Erkenntnisse, die bei der Beklagten im Rahmen ihrer Aufsichtstätigkeit anfallen. Tatsachen, deren Geheimhaltung allein im Interesse der Beklagten liegen, werden von der Verschwiegenheitspflicht des Wertpapierhandelsgesetzes (oder auch des Gesetzes über das Kreditwesen) nicht erfasst. Der Informationsanspruch auf der Grundlage des Informationsfreiheitsgesetzes besteht zudem auch dann, wenn die Geheimhaltung nach Wertpapierhandelsgesetz nicht oder nicht mehr geboten ist. Der Schutz von Betriebs- und Geschäftsgeheimnissen sowie von personenbezogenen Daten ist zu gewährleisten.","(Gesetzliche) Geheimhaltungspflichten, Aufsichtsaufgaben, Betriebs- und Geschäftsgeheimnisse, Drittbetroffenheit, Konkurrierende Rechtsvorschriften, Personenbezogene Daten, Urheberrecht",http://www.lda.brandenburg.de/media_fast/5955/VG_Frankfurt_am_Main_7_E_3280_06_V.pdf,26,http://www.lda.brandenburg.de/sixcms/detail.php?template=rechtsprechungsdb_erg_d&sort=datum&order=desc&gerichte_title=&title=&sm[title]=tablescan&sm[vt_db]=fulltext_all&datum_von=&datum_bis=&art2_title=&vt_db=&max=&skip=500
Verwaltungsgericht Frankfurt am Main,7 E 1487/07(3),23.01.2008,Urteil,Informationsfreiheitsgesetz (Bund),"Eine Behörde muss zwar auch dezentral vorhandene Informationen für einen Antragsteller zusammenstellen, ist aber nicht verpflichtet, inhaltliche Fragen im Zusammenhang mit diesen Unterlagen (hier: Rechtsfragen) zu klären. Ein entsprechender Antrag richtet sich auf Informationen, die bei der Behörde nicht vorhanden sind und erfüllt die Voraussetzungen der Bestimmtheit und Bestimmbarkeit nicht.","Auskunftserteilung, Aussonderungen, Bestimmtheit des Antrags",http://www.lda.brandenburg.de/media_fast/5955/VG_Frankfurt_am_Main_7_E_1487_07.pdf,26,http://www.lda.brandenburg.de/sixcms/detail.php?template=rechtsprechungsdb_erg_d&sort=datum&order=desc&gerichte_title=&title=&sm[title]=tablescan&sm[vt_db]=fulltext_all&datum_von=&datum_bis=&art2_title=&vt_db=&max=&skip=500
Verwaltungsgericht Hannover,4 A 6774/08,29.01.2008,Urteil,Umweltinformationsgesetz (Niedersachsen),"Durch die Herausgabe von Erfassungsbögen über Vogelarten werden keine Urheberrechte der ehrenamtlichen Kartierer verletzt, da die Werke keine ""schöpferische Eigentümlichkeit"" aufweisen. Auch liegt keine erhebliche Beeinträchtigung der Datenschutzinteressen dieser Personen vor.","Interessenabwägung, Personenbezogene Daten, Urheberrecht",http://www.lda.brandenburg.de/media_fast/5955/VG_Hannover_4_A_6774_06.pdf,26,http://www.lda.brandenburg.de/sixcms/detail.php?template=rechtsprechungsdb_erg_d&sort=datum&order=desc&gerichte_title=&title=&sm[title]=tablescan&sm[vt_db]=fulltext_all&datum_von=&datum_bis=&art2_title=&vt_db=&max=&skip=500
Oberverwaltungsgericht Rheinland-Pfalz,1 A 10886/07,20.02.2008,Urteil,Umweltinformationsgesetz (Rheinland-Pfalz),"Das OVG hebt das Urteil des VG auf und verurteilt das beklagte Land die Fragen zu Störfallbetrieben im Rahmen des LUIG zu beantworten. Bedeutsame Schutzgüter der öffentlichen Sicherheit stehen nicht entgegen. Die Auswirkungen, die von der bloßen Bekanntgabe der Betreiber, Betriebsbereiche und Anlagen der Störfallbetriebe ohne Mitteilung weitergehender Einzelheiten ausgehen, reichen nicht, um den Ausschlussgrund des Schutzes der öffentlichen Sicherheit zu erfüllen. Zu den Schutzgütern der öffentlichen Sicherheit gehören auch Individualrechtsgüter. Zur Erfüllung dieses Ausschlusstatbestands des LUIG müssen tatsächliche Anhaltspunkte dafür vorhanden sein, dass gerade die Herausgabe der verlangten Informationen die Eingriffswahrscheinlichkeit erhöht. Die begehrten Informationen sind ohnehin zumindest zum Teil bereits nach der Störfall-Verordnung der Öffentlichkeit zugänglich. Die Tatsache der Herausgabe der Informationen kann daher die Eingriffswahrscheinlichkeit nicht erhöhen und folglich eine ernsthafte, konkrete Gefahr für die öffentliche Sicherheit nicht begründen.","Ablehnungsbegründung, Begriffsbestimmung, Sicherheitsaspekte",http://www.lda.brandenburg.de/media_fast/5955/OVG_RP_1_A_10866_07.pdf,26,http://www.lda.brandenburg.de/sixcms/detail.php?template=rechtsprechungsdb_erg_d&sort=datum&order=desc&gerichte_title=&title=&sm[title]=tablescan&sm[vt_db]=fulltext_all&datum_von=&datum_bis=&art2_title=&vt_db=&max=&skip=500
Bundesverwaltungsgericht,20 F 3.07,21.02.2008,"Beschluss des Fachsenats (""in-camera""-Verfahren)",§ 99 Abs. 2 Verwaltungsgerichtsordnung,"Der Beschluss enthält ausführliche Erläuterungen zum ""in-camera""-Verfahren und zu dessen prozessualen Besonderheiten. Maßstab für die Prüfung in diesem Verfahren ist nicht das materielle Recht, über das das Hauptsachegericht zu entscheiden hat, sondern die am Maßstab der Verhältnismäßigkeit orientierte Interessengewichtung. Vor diesem Hintergrund tritt der Schutz von Betriebs- und Geschäftsgeheimnissen aus den Akten der Atomaufsichtsbehörde hinter das öffentliche Informationsinteresse zurück, soweit diese sich auf einen Störfall in einem Kernkraftwerk beziehen. Das Bundesverwaltungsgericht nimmt an der Entscheidung des Fachsenats des Oberverwaltungsgerichts nur unwesentliche Korrekturen vor.","Betriebs- und Geschäftsgeheimnisse, Drittbetroffenheit, Interessenabwägung, Prozessuales",http://www.lda.brandenburg.de/media_fast/5955/BVerwG_20_F_3_07.pdf,25,http://www.lda.brandenburg.de/sixcms/detail.php?template=rechtsprechungsdb_erg_d&sort=datum&order=desc&gerichte_title=&title=&sm[title]=tablescan&sm[vt_db]=fulltext_all&datum_von=&datum_bis=&art2_title=&vt_db=&max=&skip=480
Bundesverwaltungsgericht,4 C 13.07,21.02.2008,Urteil,"Richtlinie 2003/4/EG (Umweltinformationsrichtlinie), Umweltinformationsgesetz (Hessen)","An der Einsicht in eine vom Land Hessen geführte Datenbank (CADEC) besteht ein überwiegendes öffentliches Interesse. In der Datenbank werden Einwendungen im Rahmen des Planfeststellungsverfahrens zum Ausbau des Flughafens Frankfurt/Main gespeichert. Akteneinsicht hatten die Einwender beantragt, dagegen geklagt haben die Vorhabenträger. Die Gewährung der Einsicht war auf der Grundlage des Umweltinformationsrechts rechtmäßig, soweit den Einwendungen Argumente des Vorhabenträgers gegenüber gestellt wurden. Der Begriff ""Umweltinformationen"" ist weit auszulegen; erfasst werden auch Angaben zur wirtschaftlichen Umsetzung umweltrelevanter Maßnahmen. Antragsberechtigt können neben Bürgerinitiativen auch ein Kirchengemeindeverband oder eine Gemeinde sein, soweit ihr Selbstverwaltungsbereich berührt ist.","Begriffsbestimmung, Entwürfe oder Vorarbeiten, Interessenabwägung, Missbräuchliche Antragstellung",http://www.lda.brandenburg.de/media_fast/5955/BVerwG_4_C_13_07.pdf,25,http://www.lda.brandenburg.de/sixcms/detail.php?template=rechtsprechungsdb_erg_d&sort=datum&order=desc&gerichte_title=&title=&sm[title]=tablescan&sm[vt_db]=fulltext_all&datum_von=&datum_bis=&art2_title=&vt_db=&max=&skip=480
Verwaltungsgericht Münster,1 K 560/07,07.03.2008,Urteil,Informationsfreiheitsgesetz (Nordrhein-Westfalen),"Das Verwaltungsgericht bestätigt die Rechtmäßigkeit der Aussonderung personenbezogener Daten aus einer Baugenehmigungsakte. Als personenbezogen sind auch Grundstücksbezeichnungen zu sehen, da sie einen Rückschluss auf die Person des Grundstückseigentümers oder -nutzers zulassen.","Interessenabwägung, Personenbezogene Daten",http://www.lda.brandenburg.de/media_fast/5955/VG_Muenster_1_K_560_07.pdf,25,http://www.lda.brandenburg.de/sixcms/detail.php?template=rechtsprechungsdb_erg_d&sort=datum&order=desc&gerichte_title=&title=&sm[title]=tablescan&sm[vt_db]=fulltext_all&datum_von=&datum_bis=&art2_title=&vt_db=&max=&skip=480
Verwaltungsgericht Ansbach,AN 16 K 06.00003,20.03.2008,Urteil,Informationsfreiheitsgesetz (Bund),"Der Kläger begehrte die Erteilung von Informationen mit Bezug zu seiner Person von einer bayerischen Stadverwaltung nach dem IfG des Bundes. Die Klage wurde abgewiesen. Sie sei unzulässig, da der Kläger kein Rechtsschutzbedürfnis vorweisen könne. Vor Klageerhebung hätte er einen Auskunftsantrag bei der Behörde, von der er die Informationserteilung verlange, stellen müssen. Das Gericht stellt weiterhin klar, dass es sich bei Informationserteilung, beschränkter Erteilung und auch der Ablehnung eines Informationsersuchens um Verwaltungsakte im Sinne des § 35 VwVfG handele.","Durchführung des Antragsverfahrens, Prozessuales",http://www.lda.brandenburg.de/media_fast/5955/VG_Ansbach_16_K_06_00003.pdf,25,http://www.lda.brandenburg.de/sixcms/detail.php?template=rechtsprechungsdb_erg_d&sort=datum&order=desc&gerichte_title=&title=&sm[title]=tablescan&sm[vt_db]=fulltext_all&datum_von=&datum_bis=&art2_title=&vt_db=&max=&skip=480
Oberverwaltungsgericht Nordrhein-Westfalen,12 E 115/08,26.03.2008,Beschluss,Informationsfreiheitsgesetz (Nordrhein-Westfalen),"Das Oberverwaltungsgericht bestätigt die Entscheidung der Vorinstanz, nach der Sozialdatenschutz des § 65 Achtes Buch Sozialgesetzbuch den Zugangsanspruch des Informationsfreiheitsgesetzes Nordrhein-Westfalen sperrt. Der Beschluss befasst sich im Wesentlichen mit sozialrechtlichen Bestimmungen.","Konkurrierende Rechtsvorschriften, Personenbezogene Daten",http://www.lda.brandenburg.de/media_fast/5955/OVG_NW_12_E_115_08.pdf,25,http://www.lda.brandenburg.de/sixcms/detail.php?template=rechtsprechungsdb_erg_d&sort=datum&order=desc&gerichte_title=&title=&sm[title]=tablescan&sm[vt_db]=fulltext_all&datum_von=&datum_bis=&art2_title=&vt_db=&max=&skip=480
Verwaltungsgericht Aachen,2 K 22/08,22.04.2008,Beschluss,Informationsfreiheitsgesetz (Nordrhein-Westfalen),"Nach Erledigung des Rechtsstreits in der Hauptsache werden dem Beklagten die Kosten des Verfahrens auferlegt, da die begehrte Akteneinsicht auf der Grundlage des Informationsfreiheitsgesetzes Nordrhein-Westfalen zu gewähren gewesen wäre. Der Einsichtsanspruch für Verfahrensbeteiligte aus § 29 Verwaltungsverfahrensgesetz schließt einen Anspruch aus dem Informationsfreiheitsgesetz nicht aus. Die Einschränkungen, denen der Zugangsanspruch nach dem Informationsfreiheitsgesetz unterliegt, stellen hinreichend sicher, dass private Belange der am Verwaltungsverfahrensbeteiligten oder unbeteiligter  Dritter in vergleichbarer Weise geschützt werden. Daher kann ein Beteiligter bei Fehlen des in § 29 Verwaltungsverfahrensgesetz geforderten besonderen Interesses auf der Grundlage des Informationsfreiheitsgesetzes Akteneinsicht begehren.","Konkurrierende Rechtsvorschriften, Prozessuales",http://www.lda.brandenburg.de/media_fast/5955/VG_Aachen_8_K_22_08.pdf,25,http://www.lda.brandenburg.de/sixcms/detail.php?template=rechtsprechungsdb_erg_d&sort=datum&order=desc&gerichte_title=&title=&sm[title]=tablescan&sm[vt_db]=fulltext_all&datum_von=&datum_bis=&art2_title=&vt_db=&max=&skip=480
Verwaltungsgericht Augsburg,4 K 07.1771,22.04.2008,Beschluss,Informationsfreiheitsgesetz (Bund),Das Informationsfreiheitsgesetz ist auf die ARGE einer Stadt - eine Gemeinschaftseinrichtung der Bundesagentur für Arbeit und kommunaler Träger für die Beschäftigung nach § 44 Zweites Buch Sozialgesetzbuch - nicht anwendbar. Allein die Beteiligung der Bundesagentur macht die ARGE noch nicht zu einer Bundesbehörde. Das Gericht lehnt einen Antrag auf Prozesskostenhilfe zur Unterstützung des Begehrens auf Offenlegung der Berechnungsgrundlage für den Unterkunftszuschuss ab.,Anwendungsbereich/Zuständigkeit,http://www.lda.brandenburg.de/media_fast/5955/VG_Augsburg_4_07_1771.pdf,25,http://www.lda.brandenburg.de/sixcms/detail.php?template=rechtsprechungsdb_erg_d&sort=datum&order=desc&gerichte_title=&title=&sm[title]=tablescan&sm[vt_db]=fulltext_all&datum_von=&datum_bis=&art2_title=&vt_db=&max=&skip=480
Oberverwaltungsgericht Nordrhein-Westfalen,8 E 254/08,28.04.2008,Beschluss,Informationsfreiheitsgesetz (Nordrhein-Westfalen),"Das Oberverwaltungsgericht ändert den ablehnenden Beschluss des Verwaltungsgerichts Düsseldorf zur Bewilligung von Prozesskostenhilfe. Im Hinblick auf die für das Ergebnis entscheidende Frage, ob die Tätigkeit der Polizeibehörden auf dem Gebiet der Strafverfolgung dem Anwendungsbereich des Informationsfreiheitsgesetzes entzogen ist, sieht das Gericht das Erfordernis einer Klärung, die den Rahmen des Prozesskostenhilfeverfahrens übersteigt.","Anwendungsbereich/Zuständigkeit, Begriffsbestimmung, Sicherheitsaspekte",http://www.lda.brandenburg.de/media_fast/5955/OVG_NW_8_E_254_08.pdf,25,http://www.lda.brandenburg.de/sixcms/detail.php?template=rechtsprechungsdb_erg_d&sort=datum&order=desc&gerichte_title=&title=&sm[title]=tablescan&sm[vt_db]=fulltext_all&datum_von=&datum_bis=&art2_title=&vt_db=&max=&skip=480
Verwaltungsgericht Düsseldorf,26 L 719/08,07.05.2008,Beschluss,"Informationsfreiheitsgesetz (Nordrhein-Westfalen), Sonstige","Das Verwaltungsgericht verpflichtet auf dem Wege der einstweiligen Anordnung zur Auskunfterteilung über Maßnahmen zur Wirtschaftsförderung vor dem Hintergrund einer Betriebsverlagerung. Dies stützt es jedoch nicht auf das Informationsfreiheitsgesetz, das nur einen Anspruch für natürliche Personen vorsieht, sondern auf das Pressegesetz, da es sich bei der Antragstellerin um eine Anstalt des öffentlichen Rechts handelte.","Auskunftserteilung, Konkurrierende Rechtsvorschriften",http://www.lda.brandenburg.de/media_fast/5955/VG_Duesseldorf_26_L_719_08.pdf,25,http://www.lda.brandenburg.de/sixcms/detail.php?template=rechtsprechungsdb_erg_d&sort=datum&order=desc&gerichte_title=&title=&sm[title]=tablescan&sm[vt_db]=fulltext_all&datum_von=&datum_bis=&art2_title=&vt_db=&max=&skip=480
